PassengerId,Survived,Pclass,Name,Sex,Age,SibSp,Parch,Ticket,Fare,Cabin,Embarked
441,1,2,"Hart, Mrs. Benjamin (Esther Ada Bloomfield)",female,45.0,1,1,F.C.C. 13529,26.25,,S
521,1,1,"Perreault, Miss. Anne",female,30.0,0,0,12749,93.5,B73,S
819,0,3,"Holm, Mr. John Fredrik Alexander",male,43.0,0,0,C 7075,6.45,,S
457,0,1,"Millet, Mr. Francis Davis",male,65.0,0,0,13509,26.55,E38,S
249,1,1,"Beckwith, Mr. Richard Leonard",male,37.0,1,1,11751,52.5542,D35,S
186,0,1,"Rood, Mr. Hugh Roscoe",male,,0,0,113767,50.0,A32,S
50,0,3,"Arnold-Franchi, Mrs. Josef (Josefine Franchi)",female,18.0,1,0,349237,17.8,,S
646,1,1,"Harper, Mr. Henry Sleeper",male,48.0,1,0,PC 17572,76.7292,D33,C
505,1,1,"Maioni, Miss. Roberta",female,16.0,0,0,110152,86.5,B79,S
639,0,3,"Panula, Mrs. Juha (Maria Emilia Ojala)",female,41.0,0,5,3101295,39.6875,,S
16,1,2,"Hewlett, Mrs. (Mary D Kingcome) ",female,55.0,0,0,248706,16.0,,S
356,0,3,"Vanden Steen, Mr. Leo Peter",male,28.0,0,0,345783,9.5,,S
579,0,3,"Caram, Mrs. Joseph (Maria Elias)",female,,1,0,2689,14.4583,,C
742,0,1,"Cavendish, Mr. Tyrell William",male,36.0,1,0,19877,78.85,C46,S
492,0,3,"Windelov, Mr. Einar",male,21.0,0,0,SOTON/OQ 3101317,7.25,,S
573,1,1,"Flynn, Mr. John Irwin (""Irving"")",male,36.0,0,0,PC 17474,26.3875,E25,S
813,0,2,"Slemen, Mr. Richard James",male,35.0,0,0,28206,10.5,,S
144,0,3,"Burke, Mr. Jeremiah",male,19.0,0,0,365222,6.75,,Q
489,0,3,"Somerton, Mr. Francis William",male,30.0,0,0,A.5. 18509,8.05,,S
614,0,3,"Horgan, Mr. John",male,,0,0,370377,7.75,,Q
604,0,3,"Torber, Mr. Ernst William",male,44.0,0,0,364511,8.05,,S
630,0,3,"O'Connell, Mr. Patrick D",male,,0,0,334912,7.7333,,Q
61,0,3,"Sirayanian, Mr. Orsen",male,22.0,0,0,2669,7.2292,,C
161,0,3,"Cribb, Mr. John Hatfield",male,44.0,0,1,371362,16.1,,S
78,0,3,"Moutal, Mr. Rahamin Haim",male,,0,0,374746,8.05,,S
211,0,3,"Ali, Mr. Ahmed",male,24.0,0,0,SOTON/O.Q. 3101311,7.05,,S
714,0,3,"Larsson, Mr. August Viktor",male,29.0,0,0,7545,9.4833,,S
282,0,3,"Olsson, Mr. Nils Johan Goransson",male,28.0,0,0,347464,7.8542,,S
403,0,3,"Jussila, Miss. Mari Aina",female,21.0,1,0,4137,9.825,,S
821,1,1,"Hays, Mrs. Charles Melville (Clara Jennings Gregg)",female,52.0,1,1,12749,93.5,B69,S
717,1,1,"Endres, Miss. Caroline Louise",female,38.0,0,0,PC 17757,227.525,C45,C
853,0,3,"Boulos, Miss. Nourelain",female,9.0,1,1,2678,15.2458,,C
373,0,3,"Beavan, Mr. William Thomas",male,19.0,0,0,323951,8.05,,S
335,1,1,"Frauenthal, Mrs. Henry William (Clara Heinsheimer)",female,,1,0,PC 17611,133.65,,S
333,0,1,"Graham, Mr. George Edward",male,38.0,0,1,PC 17582,153.4625,C91,S
713,1,1,"Taylor, Mr. Elmer Zebley",male,48.0,1,0,19996,52.0,C126,S
148,0,3,"Ford, Miss. Robina Maggie ""Ruby""",female,9.0,2,2,W./C. 6608,34.375,,S
620,0,2,"Gavey, Mr. Lawrence",male,26.0,0,0,31028,10.5,,S
322,0,3,"Danoff, Mr. Yoto",male,27.0,0,0,349219,7.8958,,S
200,0,2,"Yrois, Miss. Henriette (""Mrs Harbeck"")",female,24.0,0,0,248747,13.0,,S
869,0,3,"van Melkebeke, Mr. Philemon",male,,0,0,345777,9.5,,S
887,0,2,"Montvila, Rev. Juozas",male,27.0,0,0,211536,13.0,,S
673,0,2,"Mitchell, Mr. Henry Michael",male,70.0,0,0,C.A. 24580,10.5,,S
38,0,3,"Cann, Mr. Ernest Charles",male,21.0,0,0,A./5. 2152,8.05,,S
21,0,2,"Fynney, Mr. Joseph J",male,35.0,0,0,239865,26.0,,S
138,0,1,"Futrelle, Mr. Jacques Heath",male,37.0,1,0,113803,53.1,C123,S
233,0,2,"Sjostedt, Mr. Ernst Adolf",male,59.0,0,0,237442,13.5,,S
302,1,3,"McCoy, Mr. Bernard",male,,2,0,367226,23.25,,Q
508,1,1,"Bradley, Mr. George (""George Arthur Brayton"")",male,,0,0,111427,26.55,,S
359,1,3,"McGovern, Miss. Mary",female,,0,0,330931,7.8792,,Q
568,0,3,"Palsson, Mrs. Nils (Alma Cornelia Berglund)",female,29.0,0,4,349909,21.075,,S
201,0,3,"Vande Walle, Mr. Nestor Cyriel",male,28.0,0,0,345770,9.5,,S
659,0,2,"Eitemiller, Mr. George Floyd",male,23.0,0,0,29751,13.0,,S
638,0,2,"Collyer, Mr. Harvey",male,31.0,1,1,C.A. 31921,26.25,,S
455,0,3,"Peduzzi, Mr. Joseph",male,,0,0,A/5 2817,8.05,,S
82,1,3,"Sheerlinck, Mr. Jan Baptist",male,29.0,0,0,345779,9.5,,S
185,1,3,"Kink-Heilmann, Miss. Luise Gretchen",female,4.0,0,2,315153,22.025,,S
552,0,2,"Sharp, Mr. Percival James R",male,27.0,0,0,244358,26.0,,S
718,1,2,"Troutt, Miss. Edwina Celia ""Winnie""",female,27.0,0,0,34218,10.5,E101,S
510,1,3,"Lang, Mr. Fang",male,26.0,0,0,1601,56.4958,,S
56,1,1,"Woolner, Mr. Hugh",male,,0,0,19947,35.5,C52,S
106,0,3,"Mionoff, Mr. Stoytcho",male,28.0,0,0,349207,7.8958,,S
792,0,2,"Gaskell, Mr. Alfred",male,16.0,0,0,239865,26.0,,S
306,1,1,"Allison, Master. Hudson Trevor",male,0.92,1,2,113781,151.55,C22 C26,S
120,0,3,"Andersson, Miss. Ellis Anna Maria",female,2.0,4,2,347082,31.275,,S
81,0,3,"Waelens, Mr. Achille",male,22.0,0,0,345767,9.0,,S
526,0,3,"Farrell, Mr. James",male,40.5,0,0,367232,7.75,,Q
531,1,2,"Quick, Miss. Phyllis May",female,2.0,1,1,26360,26.0,,S
368,1,3,"Moussa, Mrs. (Mantoura Boulos)",female,,0,0,2626,7.2292,,C
783,0,1,"Long, Mr. Milton Clyde",male,29.0,0,0,113501,30.0,D6,S
389,0,3,"Sadlier, Mr. Matthew",male,,0,0,367655,7.7292,,Q
97,0,1,"Goldschmidt, Mr. George B",male,71.0,0,0,PC 17754,34.6542,A5,C
524,1,1,"Hippach, Mrs. Louis Albert (Ida Sophia Fischer)",female,44.0,0,1,111361,57.9792,B18,C
488,0,1,"Kent, Mr. Edward Austin",male,58.0,0,0,11771,29.7,B37,C
891,0,3,"Dooley, Mr. Patrick",male,32.0,0,0,370376,7.75,,Q
503,0,3,"O'Sullivan, Miss. Bridget Mary",female,,0,0,330909,7.6292,,Q
594,0,3,"Bourke, Miss. Mary",female,,0,2,364848,7.75,,Q
751,1,2,"Wells, Miss. Joan",female,4.0,1,1,29103,23.0,,S
24,1,1,"Sloper, Mr. William Thompson",male,28.0,0,0,113788,35.5,A6,S
826,0,3,"Flynn, Mr. John",male,,0,0,368323,6.95,,Q
629,0,3,"Bostandyeff, Mr. Guentcho",male,26.0,0,0,349224,7.8958,,S
680,1,1,"Cardeza, Mr. Thomas Drake Martinez",male,36.0,0,1,PC 17755,512.3292,B51 B53 B55,C
191,1,2,"Pinsky, Mrs. (Rosa)",female,32.0,0,0,234604,13.0,,S
636,1,2,"Davis, Miss. Mary",female,28.0,0,0,237668,13.0,,S
608,1,1,"Daniel, Mr. Robert Williams",male,27.0,0,0,113804,30.5,,S
463,0,1,"Gee, Mr. Arthur H",male,47.0,0,0,111320,38.5,E63,S
569,0,3,"Doharr, Mr. Tannous",male,,0,0,2686,7.2292,,C
872,1,1,"Beckwith, Mrs. Richard Leonard (Sallie Monypeny)",female,47.0,1,1,11751,52.5542,D35,S
857,1,1,"Wick, Mrs. George Dennick (Mary Hitchcock)",female,45.0,1,1,36928,164.8667,,S
513,1,1,"McGough, Mr. James Robert",male,36.0,0,0,PC 17473,26.2875,E25,S
208,1,3,"Albimona, Mr. Nassef Cassem",male,26.0,0,0,2699,18.7875,,C
358,0,2,"Funk, Miss. Annie Clemmer",female,38.0,0,0,237671,13.0,,S
387,0,3,"Goodwin, Master. Sidney Leonard",male,1.0,5,2,CA 2144,46.9,,S
516,0,1,"Walker, Mr. William Anderson",male,47.0,0,0,36967,34.0208,D46,S
723,0,2,"Gillespie, Mr. William Henry",male,34.0,0,0,12233,13.0,,S
229,0,2,"Fahlstrom, Mr. Arne Jonas",male,18.0,0,0,236171,13.0,,S
87,0,3,"Ford, Mr. William Neal",male,16.0,1,3,W./C. 6608,34.375,,S
307,1,1,"Fleming, Miss. Margaret",female,,0,0,17421,110.8833,,C
95,0,3,"Coxon, Mr. Daniel",male,59.0,0,0,364500,7.25,,S
596,0,3,"Van Impe, Mr. Jean Baptiste",male,36.0,1,1,345773,24.15,,S
124,1,2,"Webber, Miss. Susan",female,32.5,0,0,27267,13.0,E101,S
625,0,3,"Bowen, Mr. David John ""Dai""",male,21.0,0,0,54636,16.1,,S
587,0,2,"Jarvis, Mr. John Denzil",male,47.0,0,0,237565,15.0,,S
288,0,3,"Naidenoff, Mr. Penko",male,22.0,0,0,349206,7.8958,,S
839,1,3,"Chip, Mr. Chang",male,32.0,0,0,1601,56.4958,,S
222,0,2,"Bracken, Mr. James H",male,27.0,0,0,220367,13.0,,S
753,0,3,"Vande Velde, Mr. Johannes Joseph",male,33.0,0,0,345780,9.5,,S
382,1,3,"Nakid, Miss. Maria (""Mary"")",female,1.0,0,2,2653,15.7417,,C
43,0,3,"Kraeff, Mr. Theodor",male,,0,0,349253,7.8958,,C
376,1,1,"Meyer, Mrs. Edgar Joseph (Leila Saks)",female,,1,0,PC 17604,82.1708,,C
679,0,3,"Goodwin, Mrs. Frederick (Augusta Tyler)",female,43.0,1,6,CA 2144,46.9,,S
261,0,3,"Smith, Mr. Thomas",male,,0,0,384461,7.75,,Q
498,0,3,"Shellard, Mr. Frederick William",male,,0,0,C.A. 6212,15.1,,S
786,0,3,"Harmer, Mr. Abraham (David Lishin)",male,25.0,0,0,374887,7.25,,S
727,1,2,"Renouf, Mrs. Peter Henry (Lillian Jefferys)",female,30.0,3,0,31027,21.0,,S
877,0,3,"Gustafsson, Mr. Alfred Ossian",male,20.0,0,0,7534,9.8458,,S
545,0,1,"Douglas, Mr. Walter Donald",male,50.0,1,0,PC 17761,106.425,C86,C
685,0,2,"Brown, Mr. Thomas William Solomon",male,60.0,1,1,29750,39.0,,S
666,0,2,"Hickman, Mr. Lewis",male,32.0,2,0,S.O.C. 14879,73.5,,S
232,0,3,"Larsson, Mr. Bengt Edvin",male,29.0,0,0,347067,7.775,,S
86,1,3,"Backstrom, Mrs. Karl Alfred (Maria Mathilda Gustafsson)",female,33.0,3,0,3101278,15.85,,S
125,0,1,"White, Mr. Percival Wayland",male,54.0,0,1,35281,77.2875,D26,S
787,1,3,"Sjoblom, Miss. Anna Sofia",female,18.0,0,0,3101265,7.4958,,S
12,1,1,"Bonnell, Miss. Elizabeth",female,58.0,0,0,113783,26.55,C103,S
420,0,3,"Van Impe, Miss. Catharina",female,10.0,0,2,345773,24.15,,S
285,0,1,"Smith, Mr. Richard William",male,,0,0,113056,26.0,A19,S
833,0,3,"Saad, Mr. Amin",male,,0,0,2671,7.2292,,C
460,0,3,"O'Connor, Mr. Maurice",male,,0,0,371060,7.75,,Q
46,0,3,"Rogers, Mr. William John",male,,0,0,S.C./A.4. 23567,8.05,,S
478,0,3,"Braund, Mr. Lewis Richard",male,29.0,1,0,3460,7.0458,,S
108,1,3,"Moss, Mr. Albert Johan",male,,0,0,312991,7.775,,S
838,0,3,"Sirota, Mr. Maurice",male,,0,0,392092,8.05,,S
576,0,3,"Patchett, Mr. George",male,19.0,0,0,358585,14.5,,S
880,1,1,"Potter, Mrs. Thomas Jr (Lily Alexenia Wilson)",female,56.0,0,1,11767,83.1583,C50,C
55,0,1,"Ostby, Mr. Engelhart Cornelius",male,65.0,0,1,113509,61.9792,B30,C
495,0,3,"Stanley, Mr. Edward Roland",male,21.0,0,0,A/4 45380,8.05,,S
172,0,3,"Rice, Master. Arthur",male,4.0,4,1,382652,29.125,,Q
561,0,3,"Morrow, Mr. Thomas Rowan",male,,0,0,372622,7.75,,Q
415,1,3,"Sundman, Mr. Johan Julian",male,44.0,0,0,STON/O 2. 3101269,7.925,,S
102,0,3,"Petroff, Mr. Pastcho (""Pentcho"")",male,,0,0,349215,7.8958,,S
158,0,3,"Corn, Mr. Harry",male,30.0,0,0,SOTON/OQ 392090,8.05,,S
747,0,3,"Abbott, Mr. Rossmore Edward",male,16.0,1,1,C.A. 2673,20.25,,S
343,0,2,"Collander, Mr. Erik Gustaf",male,28.0,0,0,248740,13.0,,S
634,0,1,"Parr, Mr. William Henry Marsh",male,,0,0,112052,0.0,,S
537,0,1,"Butt, Major. Archibald Willingham",male,45.0,0,0,113050,26.55,B38,S
326,1,1,"Young, Miss. Marie Grice",female,36.0,0,0,PC 17760,135.6333,C32,C
669,0,3,"Cook, Mr. Jacob",male,43.0,0,0,A/5 3536,8.05,,S
512,0,3,"Webber, Mr. James",male,,0,0,SOTON/OQ 3101316,8.05,,S
192,0,2,"Carbines, Mr. William",male,19.0,0,0,28424,13.0,,S
847,0,3,"Sage, Mr. Douglas Bullen",male,,8,2,CA. 2343,69.55,,S
400,1,2,"Trout, Mrs. William H (Jessie L)",female,28.0,0,0,240929,12.65,,S
878,0,3,"Petroff, Mr. Nedelio",male,19.0,0,0,349212,7.8958,,S
176,0,3,"Klasen, Mr. Klas Albin",male,18.0,1,1,350404,7.8542,,S
865,0,2,"Gill, Mr. John William",male,24.0,0,0,233866,13.0,,S
212,1,2,"Cameron, Miss. Clear Annie",female,35.0,0,0,F.C.C. 13528,21.0,,S
184,1,2,"Becker, Master. Richard F",male,1.0,2,1,230136,39.0,F4,S
10,1,2,"Nasser, Mrs. Nicholas (Adele Achem)",female,14.0,1,0,237736,30.0708,,C
665,1,3,"Lindqvist, Mr. Eino William",male,20.0,1,0,STON/O 2. 3101285,7.925,,S
96,0,3,"Shorney, Mr. Charles Joseph",male,,0,0,374910,8.05,,S
588,1,1,"Frolicher-Stehli, Mr. Maxmillian",male,60.0,1,1,13567,79.2,B41,C
476,0,1,"Clifford, Mr. George Quincy",male,,0,0,110465,52.0,A14,S
47,0,3,"Lennon, Mr. Denis",male,,1,0,370371,15.5,,Q
578,1,1,"Silvey, Mrs. William Baird (Alice Munger)",female,39.0,1,0,13507,55.9,E44,S
590,0,3,"Murdlin, Mr. Joseph",male,,0,0,A./5. 3235,8.05,,S
774,0,3,"Elias, Mr. Dibo",male,,0,0,2674,7.225,,C
678,1,3,"Turja, Miss. Anna Sofia",female,18.0,0,0,4138,9.8417,,S
771,0,3,"Lievens, Mr. Rene Aime",male,24.0,0,0,345781,9.5,,S
570,1,3,"Jonsson, Mr. Carl",male,32.0,0,0,350417,7.8542,,S
283,0,3,"de Pelsmaeker, Mr. Alfons",male,16.0,0,0,345778,9.5,,S
788,0,3,"Rice, Master. George Hugh",male,8.0,4,1,382652,29.125,,Q
600,1,1,"Duff Gordon, Sir. Cosmo Edmund (""Mr Morgan"")",male,49.0,1,0,PC 17485,56.9292,A20,C
681,0,3,"Peters, Miss. Katie",female,,0,0,330935,8.1375,,Q
128,1,3,"Madsen, Mr. Fridtjof Arne",male,24.0,0,0,C 17369,7.1417,,S
509,0,3,"Olsen, Mr. Henry Margido",male,28.0,0,0,C 4001,22.525,,S
72,0,3,"Goodwin, Miss. Lillian Amy",female,16.0,5,2,CA 2144,46.9,,S
365,0,3,"O'Brien, Mr. Thomas",male,,1,0,370365,15.5,,Q
267,0,3,"Panula, Mr. Ernesti Arvid",male,16.0,4,1,3101295,39.6875,,S
397,0,3,"Olsson, Miss. Elina",female,31.0,0,0,350407,7.8542,,S
748,1,2,"Sinkkonen, Miss. Anna",female,30.0,0,0,250648,13.0,,S
319,1,1,"Wick, Miss. Mary Natalie",female,31.0,0,2,36928,164.8667,C7,S
789,1,3,"Dean, Master. Bertram Vere",male,1.0,1,2,C.A. 2315,20.575,,S
393,0,3,"Gustafsson, Mr. Johan Birger",male,28.0,2,0,3101277,7.925,,S
522,0,3,"Vovk, Mr. Janko",male,22.0,0,0,349252,7.8958,,S
412,0,3,"Hart, Mr. Henry",male,,0,0,394140,6.8583,,Q
557,1,1,"Duff Gordon, Lady. (Lucille Christiana Sutherland) (""Mrs Morgan"")",female,48.0,1,0,11755,39.6,A16,C
453,0,1,"Foreman, Mr. Benjamin Laventall",male,30.0,0,0,113051,27.75,C111,C
190,0,3,"Turcin, Mr. Stjepan",male,36.0,0,0,349247,7.8958,,S
6,0,3,"Moran, Mr. James",male,,0,0,330877,8.4583,,Q
5,0,3,"Allen, Mr. William Henry",male,35.0,0,0,373450,8.05,,S
276,1,1,"Andrews, Miss. Kornelia Theodosia",female,63.0,1,0,13502,77.9583,D7,S
362,0,2,"del Carlo, Mr. Sebastiano",male,29.0,1,0,SC/PARIS 2167,27.7208,,C
565,0,3,"Meanwell, Miss. (Marion Ogden)",female,,0,0,SOTON/O.Q. 392087,8.05,,S
71,0,2,"Jenkin, Mr. Stephen Curnow",male,32.0,0,0,C.A. 33111,10.5,,S
467,0,2,"Campbell, Mr. William",male,,0,0,239853,0.0,,S
66,1,3,"Moubarek, Master. Gerios",male,,1,1,2661,15.2458,,C
413,1,1,"Minahan, Miss. Daisy E",female,33.0,1,0,19928,90.0,C78,Q
856,1,3,"Aks, Mrs. Sam (Leah Rosen)",female,18.0,0,1,392091,9.35,,S
741,1,1,"Hawksford, Mr. Walter James",male,,0,0,16988,30.0,D45,S
100,0,2,"Kantor, Mr. Sinai",male,34.0,1,0,244367,26.0,,S
183,0,3,"Asplund, Master. Clarence Gustaf Hugo",male,9.0,4,2,347077,31.3875,,S
162,1,2,"Watt, Mrs. James (Elizabeth ""Bessie"" Inglis Milne)",female,40.0,0,0,C.A. 33595,15.75,,S
720,0,3,"Johnson, Mr. Malkolm Joackim",male,33.0,0,0,347062,7.775,,S
277,0,3,"Lindblom, Miss. Augusta Charlotta",female,45.0,0,0,347073,7.75,,S
351,0,3,"Odahl, Mr. Nils Martin",male,23.0,0,0,7267,9.225,,S
269,1,1,"Graham, Mrs. William Thompson (Edith Junkins)",female,58.0,0,1,PC 17582,153.4625,C125,S
357,1,1,"Bowerman, Miss. Elsie Edith",female,22.0,0,1,113505,55.0,E33,S
888,1,1,"Graham, Miss. Margaret Edith",female,19.0,0,0,112053,30.0,B42,S
518,0,3,"Ryan, Mr. Patrick",male,,0,0,371110,24.15,,Q
501,0,3,"Calic, Mr. Petar",male,17.0,0,0,315086,8.6625,,S
815,0,3,"Tomlin, Mr. Ernest Portage",male,30.5,0,0,364499,8.05,,S
44,1,2,"Laroche, Miss. Simonne Marie Anne Andree",female,3.0,1,2,SC/Paris 2123,41.5792,,C
834,0,3,"Augustsson, Mr. Albert",male,23.0,0,0,347468,7.8542,,S
806,0,3,"Johansson, Mr. Karl Johan",male,31.0,0,0,347063,7.775,,S
272,1,3,"Tornquist, Mr. William Henry",male,25.0,0,0,LINE,0.0,,S
864,0,3,"Sage, Miss. Dorothy Edith ""Dolly""",female,,8,2,CA. 2343,69.55,,S
63,0,1,"Harris, Mr. Henry Birkhardt",male,45.0,1,0,36973,83.475,C83,S
733,0,2,"Knight, Mr. Robert J",male,,0,0,239855,0.0,,S
65,0,1,"Stewart, Mr. Albert A",male,,0,0,PC 17605,27.7208,,C
160,0,3,"Sage, Master. Thomas Henry",male,,8,2,CA. 2343,69.55,,S
459,1,2,"Toomey, Miss. Ellen",female,50.0,0,0,F.C.C. 13531,10.5,,S
182,0,2,"Pernot, Mr. Rene",male,,0,0,SC/PARIS 2131,15.05,,C
643,0,3,"Skoog, Miss. Margit Elizabeth",female,2.0,3,2,347088,27.9,,S
136,0,2,"Richard, Mr. Emile",male,23.0,0,0,SC/PARIS 2133,15.0458,,C
738,1,1,"Lesurer, Mr. Gustave J",male,35.0,0,0,PC 17755,512.3292,B101,C
601,1,2,"Jacobsohn, Mrs. Sidney Samuel (Amy Frances Christy)",female,24.0,2,1,243847,27.0,,S
482,0,2,"Frost, Mr. Anthony Wood ""Archie""",male,,0,0,239854,0.0,,S
401,1,3,"Niskanen, Mr. Juha",male,39.0,0,0,STON/O 2. 3101289,7.925,,S
676,0,3,"Edvardsson, Mr. Gustaf Hjalmar",male,18.0,0,0,349912,7.775,,S
13,0,3,"Saundercock, Mr. William Henry",male,20.0,0,0,A/5. 2151,8.05,,S
689,0,3,"Fischer, Mr. Eberhard Thelander",male,18.0,0,0,350036,7.7958,,S
418,1,2,"Silven, Miss. Lyyli Karoliina",female,18.0,0,2,250652,13.0,,S
763,1,3,"Barah, Mr. Hanna Assi",male,20.0,0,0,2663,7.2292,,C
743,1,1,"Ryerson, Miss. Susan Parker ""Suzette""",female,21.0,2,2,PC 17608,262.375,B57 B59 B63 B66,C
103,0,1,"White, Mr. Richard Frasar",male,21.0,0,1,35281,77.2875,D26,S
599,0,3,"Boulos, Mr. Hanna",male,,0,0,2664,7.225,,C
483,0,3,"Rouse, Mr. Richard Henry",male,50.0,0,0,A/5 3594,8.05,,S
122,0,3,"Moore, Mr. Leonard Charles",male,,0,0,A4. 54510,8.05,,S
529,0,3,"Salonen, Mr. Johan Werner",male,39.0,0,0,3101296,7.925,,S
76,0,3,"Moen, Mr. Sigurd Hansen",male,25.0,0,0,348123,7.65,F G73,S
205,1,3,"Cohen, Mr. Gurshon ""Gus""",male,18.0,0,0,A/5 3540,8.05,,S
166,1,3,"Goldsmith, Master. Frank John William ""Frankie""",male,9.0,0,2,363291,20.525,,S
197,0,3,"Mernagh, Mr. Robert",male,,0,0,368703,7.75,,Q
58,0,3,"Novel, Mr. Mansouer",male,28.5,0,0,2697,7.2292,,C
109,0,3,"Rekic, Mr. Tido",male,38.0,0,0,349249,7.8958,,S
107,1,3,"Salkjelsvik, Miss. Anna Kristine",female,21.0,0,0,343120,7.65,,S
17,0,3,"Rice, Master. Eugene",male,2.0,4,1,382652,29.125,,Q
527,1,2,"Ridsdale, Miss. Lucy",female,50.0,0,0,W./C. 14258,10.5,,S
168,0,3,"Skoog, Mrs. William (Anna Bernhardina Karlsson)",female,45.0,1,4,347088,27.9,,S
746,0,1,"Crosby, Capt. Edward Gifford",male,70.0,1,1,WE/P 5735,71.0,B22,S
797,1,1,"Leader, Dr. Alice (Farnham)",female,49.0,0,0,17465,25.9292,D17,S
627,0,2,"Kirkland, Rev. Charles Leonard",male,57.0,0,0,219533,12.35,,Q
779,0,3,"Kilgannon, Mr. Thomas J",male,,0,0,36865,7.7375,,Q
254,0,3,"Lobb, Mr. William Arthur",male,30.0,1,0,A/5. 3336,16.1,,S
89,1,1,"Fortune, Miss. Mabel Helen",female,23.0,3,2,19950,263.0,C23 C25 C27,S
854,1,1,"Lines, Miss. Mary Conover",female,16.0,0,1,PC 17592,39.4,D28,S
171,0,1,"Van der hoef, Mr. Wyckoff",male,61.0,0,0,111240,33.5,B19,S
582,1,1,"Thayer, Mrs. John Borland (Marian Longstreth Morris)",female,39.0,1,1,17421,110.8833,C68,C
242,1,3,"Murphy, Miss. Katherine ""Kate""",female,,1,0,367230,15.5,,Q
533,0,3,"Elias, Mr. Joseph Jr",male,17.0,1,1,2690,7.2292,,C
852,0,3,"Svensson, Mr. Johan",male,74.0,0,0,347060,7.775,,S
253,0,1,"Stead, Mr. William Thomas",male,62.0,0,0,113514,26.55,C87,S
36,0,1,"Holverson, Mr. Alexander Oskar",male,42.0,1,0,113789,52.0,,S
247,0,3,"Lindahl, Miss. Agda Thorilda Viktoria",female,25.0,0,0,347071,7.775,,S
619,1,2,"Becker, Miss. Marion Louise",female,4.0,2,1,230136,39.0,F4,S
859,1,3,"Baclini, Mrs. Solomon (Latifa Qurban)",female,24.0,0,3,2666,19.2583,,C
686,0,2,"Laroche, Mr. Joseph Philippe Lemercier",male,25.0,1,2,SC/Paris 2123,41.5792,,C
653,0,3,"Kalvik, Mr. Johannes Halvorsen",male,21.0,0,0,8475,8.4333,,S
263,0,1,"Taussig, Mr. Emil",male,52.0,1,1,110413,79.65,E67,S
